CodeJeu|NomJeu|DateAchat|Emplacement|Marque|Annee_Edition|NbJoueurs|AgeJoueurs|Manque|TypeJeu|NbPieces|TempsJeu|EtatJeu|Descriptif1|Descriptif2|Descriptif3|LienImg|Commentaire|NbPoints|NiveauJeu|Classification|PrixEstimé|Auteur|Illustrateur|SurPlace|Contenu1|Contenu2
1704|Rain Man|11/08/2020||Presses Pocket|||||4 médiathèque livres CD|1||Vendus par Martine Peyras|De Léonore Fleisher| | |C:\Ludopret\Annexes\Images\1704 Rain man.jpg||1|||5|||N||
1705|Autisme la vérité refusée|11/08/2020||SIMEP|||||4 médiathèque livres CD|1||Vendus par Martine Peyras|De Edward R.Ritvo et Gloria Laxer| | |C:\Ludopret\Annexes\Images\1705 autisme la vérité refusée.jpg||1|||20|||N||
1706|Papa et maman m'ont dit|11/08/2020||Rivages|||||4 médiathèque livres CD|1||Vendus par Martine Peyras|De Alain Le Saux| | |C:\Ludopret\Annexes\Images\1706 papa et maman m'ont dit.jpg||1|||20|||N||
1707|Les vendanges du silence|11/08/2020||Robert Laffont|||||4 médiathèque livres CD|1||Vendus par Martine Peyras|De Gloria Laxer| | |C:\Ludopret\Annexes\Images\1707 les vendanges du silence.jpg||1|||8|||N||
1708|Un bonheur que je ne souhaite à personne|11/08/2020||Flammarion|||||4 médiathèque livres CD|1||Vendus par Martine Peyras|De Samuel Le Bihan| | |C:\Ludopret\Annexes\Images\1708 Un bonheur que je ne souhaite à personne.jpg||1|||18|||N||
1709|Progressions éducatives|11/08/2020||Puf|||||4 médiathèque livres CD|1||Vendus par Martine Peyras|pour handicapés mentaux. De Alfred et Françoise Brauner| | |C:\Ludopret\Annexes\Images\1709 progressions educatives pour handicapés mentaux.JPG||1|||12|||N||
1710|L'énigme de l'autisme|11/08/2020||Odile Jacob|||||4 médiathèque livres CD|1||Vendus par Martine Peyras|De Uta Frith| | |C:\Ludopret\Annexes\Images\1710 L'enigme de l'autisme.jpg||1|||10|||N||
1711|Le syndrôme d'Asperger|11/08/2020||DUNOD|||||4 médiathèque livres CD|1||Vendus par Martine Peyras|et l'autisme de haut niveau.De Tony Attwood| | |C:\Ludopret\Annexes\Images\1711 Le syndrome d'Asperger et l'autisme de haut niveau.jpg||1|||28|||N||
1712|De l'éducation des autistes déficitaires|11/08/2020||érès|||||4 médiathèque livres CD|1||Vendus par Martine Peyras|De Gloria Laxer| | |C:\Ludopret\Annexes\Images\1712 Education autistes déficitaires.jpg||1|||25|||N||
1713|Quelqu'un quelque part|11/08/2020||J'ai lu|||||4 médiathèque livres CD|1||Vendus par Martine Peyras|La suite du best seller "si on me touche, je n'existe plus". De Donna Williams.| | |C:\Ludopret\Annexes\Images\1713 quelqu'un quelque part.JPG||1|||5|||N||
1714|L'autisme aspects éducatifs et médicaux|11/08/2020||||||||1|||Dr C.Gillberg et T.Peeters| | |C:\Ludopret\Annexes\Images\1714 L'autisme aspects éducatifs et médicaux.jpg||1|||15|||N||
1715|Autisme: la forteresse éclatée|11/08/2020||Pro Aid Autisme|||||4 médiathèque livres CD|1||Vendus par Martine Peyras|De Théo Peeters| | |C:\Ludopret\Annexes\Images\1715 Autisme la forteresse éclatée.jpg||1|||20|||N||
1716|Intervention béhaviorale auprés d'autistes|11/08/2020||DE Boeck|||||4 médiathèque livres CD|1||Vendus par Martine Peyras|auprés des jeunes enfants autistes. De Catherine Maurice.| | |C:\Ludopret\Annexes\Images\1716 Intervention béhaviorale auprès des jeunes enfants autistes.jpg||1|||45|||N||
1683|Tests de compétence lingusitiques|12/08/2020||Upbility|||||upbility|1||Neuf été 2020|Pour les 3-4 ans. 1 coffret Upbility avec 1 livret seul.| | |C:\Ludopret\Annexes\Images\1683 Tests de compétence linguistique Upbility.png||1|||30|||N||
1684|Remédier aux difficultés en maths|12/08/2020||Upbility|||||upbility|1||Neuf été 2020|1 coffret Upbility avec 1 livret et 2 jeux.| | |C:\Ludopret\Annexes\Images\1684 Remédier aux maths Upbility.png||1|||20|||N||
1685|Liaisons sémantiques|12/08/2020||Upbility|||||upbility|1||Neuf été 2020| coffret Upbility avec un livret seulement.| | |C:\Ludopret\Annexes\Images\1685 Liaisons sémantiques.png||1|||30|||N||
1686|Asperger quest-ce que c'est pour moi|12/08/2020||Centre de Com Concrète|||||4 médiathèque livres CD|1||Dons de Martine Peyras|1 classeur de fiches sous plastiques.| | |C:\Ludopret\Annexes\Images\1686 Asperger quest-ce que c'est pour moi.jpg||1|||39|||N||
1717|Quirkle|12/08/2020||Iello|||||7 aide autom assoc tps|1||Neuf été 2020|Contenu: 1 sac tissus de 108 jetons en bois, 1 règle et 4 réglettes et 6 fiches "résultats" plastifiées (extension du jeu incluse).| | |C:\Ludopret\Annexes\Images\1717 quirckle.jpg||1|||0|||N||
1718|Dobble Harry Potter|12/08/2020||Asmodée|||||7 aide autom assoc tps|1||Neuf été 2020|jeu de 55 cartes et 1 règle.| | |C:\Ludopret\Annexes\Images\1718 Dobble Harry Potter.jpg||1|||0|||N||
1719|Et si on jouait avec les émotions|12/08/2020||Hachette|||||8 jeux symboliques et imitatio|1||Neuf été 2020|Coffret: 1 règle du jeu, un plateau de jeu, un poster d'émotions ressentis, 8 cartes de régulation émotionnelle, 14 cartes émotion (rouges), 12 cartes scénario (vertes), 54 cartes jeu des 9 familles.| | |C:\Ludopret\Annexes\Images\1719 Et si on jouait avec les émotions.jpeg||1|||0|||N||
1720|Crazy cups|12/08/2020||Gigamic|||||7 aide autom assoc tps|1||Neuf été 2020|Contenu: 1 règle du jeu, 20 gobelets (5 couleurs), 1 sonnette, 43 cartes (dont 19 de l'extension achetée en plus).| | |C:\Ludopret\Annexes\Images\1720 Crazy cups.jpg||1|||30|||N||
1721|J'apprends à me relaxer|12/08/2020||Nathan|||||4 médiathèque livres CD|1||Neuf été 2020| livre avec 1 CD.| | |C:\Ludopret\Annexes\Images\1721 J'apprends à me relaxer.jpg||1|||13,8|||N||
1722|Structurer le vocabulaire cycle 2|12/08/2020||Nathan|||||4 médiathèque livres CD|1||Neuf été 2020||||C:\Ludopret\Annexes\Images\1722 Structurer le vocabulaire Cycle 2.jpg||1|||0|||N||
1723|Lire et comprendre|12/08/2020||Retz|||||4 médiathèque livres CD|1||Neuf été 2020|les mots, les phrases, l'implicite.Contenu: 1 livre et un CD| | |C:\Ludopret\Annexes\Images\1723 Lire et comprendre les mots, les phrases, l'implicite.jpg||1|||0|||N||
1724|1000 mots en plus avec Vocaplus|12/08/2020||Nathan|||||4 médiathèque livres CD|1||Neuf été 2020|1 coffret comprenant 1 livret de fiches, 1 livret explicatif et 1 CD.| | |C:\Ludopret\Annexes\Images\1724 vocaplus CE1CE2.jpg||1|||0|||N||
1740|Exemples d'exos de grammaire|19/08/2020||inconnu|||||4 médiathèque livres CD|1||Dons de Martine Peyras|1 livret de fiches d'exercices| | |C:\Ludopret\Annexes\Images\1740 exs d'exos de grammaire.jpg||1|||5|||N||
1739|exemples de compréhension de textes courts|19/08/2020||inconnu|||||4 médiathèque livres CD|1||Dons de Martine Peyras|1 livret ressort de fiches d'exercices| | |C:\Ludopret\Annexes\Images\1739 exs d'exos de compréhension de textes courts.jpg||1|||5|||N||
1738|cahier de motricité graphique|19/08/2020||inconnu|||||4 médiathèque livres CD|1||Dons de Martine Peyras|1 livret à ressorts de fiches plastifiées| | |C:\Ludopret\Annexes\Images\1738c cahier de motricité graphique.jpg||1|||10|||N||
1737|Labortho visu et théorie de l'esprit|19/08/2020||labortho|||||4 médiathèque livres CD|1||Dons de Martine Peyras|1 livret à ressort avec des ficches d'exercices.Possibilité de les télécharger sur e site labortho.fr| | |C:\Ludopret\Annexes\Images\1737 Labortho fiches visu.jpg||1|||5|||N||
1736|Educautisme module loisirs|19/08/2020||inconnu|||||4 médiathèque livres CD|1||Dons de Martine Peyras|1 livret à ressorts.| | |C:\Ludopret\Annexes\Images\1736 Educautisme module loisirs.jpg||1|||5|||N||
1735|Educautisme module autonomie|19/08/2020||inconnu|||||4 médiathèque livres CD|1||Dons de Martine Peyras|1 livret à ressorts.| | |C:\Ludopret\Annexes\Images\1735 Educautisme moduel autonomie.jpg||1|||5|||N||
1734|Comprendre les signaux sensoriels|19/08/2020||inconnu|||||4 médiathèque livres CD|1||Dons de Martine Peyras|… de votre enfant.1 livret à ressorts.| | |C:\Ludopret\Annexes\Images\1734 Comprendre les signaux sensoriels de votre enfant.jpg||1|||10|||N||
1729|Autismes et cognitions|19/08/2020||CRA|||||4 médiathèque livres CD|1||Dons de Martine Peyras|1 livret à ressorts.| | |C:\Ludopret\Annexes\Images\1729 autisme et cognitions.jpg||1|||5|||N||
1728|Les particularités sensorielles chez le TSA|19/08/2020||CRA|||||4 médiathèque livres CD|1||Dons de Martine Peyras|1 livret à ressort, conférence au CRA.| | |C:\Ludopret\Annexes\Images\1728 les particularités sensorielles chez la personne autiste.jpg||1|||5|||N||
1727|Particularités sensorielles|19/08/2020||inconnu|||||4 médiathèque livres CD|1||Dons de Martine Peyras|Sens, sensations et perceptions.1 livret à ressorts, présentation ppt.| | |C:\Ludopret\Annexes\Images\1727 résumé particularités sensorielles0004.jpg||1|||5|||N||
1726|Le TSA: cerveau différent, mêmes ambitions|19/08/2020||CCSI|||||4 médiathèque livres CD|1||Dons de Martine Peyras|1 livret à ressorts, présentation ppt dans le cadre d'un colloque du CCSI.| | |C:\Ludopret\Annexes\Images\1726 colloque CCSI Québec don Martine.JPG||1|||5|||N||
1730|Les cahiers de l'autisme l'hygiène|19/08/2020||CRA|||||4 médiathèque livres CD|1||Dons de Martine Peyras|1 livret à ressorts.| | |C:\Ludopret\Annexes\Images\1730 les cahiers de l'autisme.jpg||1|||5|||N||
1732|Task galore exs d'exercices pratiques Teacch|19/08/2020||inconnu|||||4 médiathèque livres CD|1||Dons de Martine Peyras|1 classeu r souplede fiches plastifiées. Contenu: une copie succinte du Task Galore rouge et des exemples en images de pratiques Teacch.| | |C:\Ludopret\Annexes\Images\1732 exemples du Task galore rouge.JPG||1|||5|||N||
1731|Fiches d'apprentissage pour ados et adultes|19/08/2020||inconnu|||||4 médiathèque livres CD|1||Dons de Martine Peyras|1 dossier de fiches plastifiées avec des exemples concrets d'exercices sensorimoteurs pour l'accession à l'autonomie| | |C:\Ludopret\Annexes\Images\1731 fiches pour ados et adultes avec DI.JPG||1|||5|||N||
1733|Scénarios sociaux de Carole Gray|19/08/2020||inconnu|||||4 médiathèque livres CD|1||Dons de Martine Peyras|1 dossier plastique contenant 2 livres à ressorts, copies du livre de Carole Gray, don de Martine.| | |C:\Ludopret\Annexes\Images\1733 scénarios sociaux Carol Gray.JPG||1|||20|||N||
1725|Babyfoot|19/08/2020||Amazon|||||2 motricité globale|1||Neuf été 2020|pliable.| | |C:\Ludopret\Annexes\Images\1725 babyfoot d'Annie.jpg||1|||0|||N||
1777|Le programme EFI-RE|07/12/2020||DE Boeck|||||4 médiathèque livres CD|1||neuf déc2020||||C:\Ludopret\Annexes\Images\1777 programme EFI-RE.jpg||1|||0|||N||
1776|L'ABA à l'école|07/12/2020||ABA site|||||4 médiathèque livres CD|1||neuf déc2020||||C:\Ludopret\Annexes\Images\1776 ABA à l'école.jpg||1|||0|||N||
1775|La langue des signes autisme|07/12/2020||DE Boeck|||||4 médiathèque livres CD|1||neuf déc2020||||C:\Ludopret\Annexes\Images\1775 La-langue-des-signes-francaise-au-service-des-personnes-avec-autisme.jpg||1|||0|||N||
1774|Chez nous c'est comme ça|07/12/2020||Autisme Diffusion AFD|||||4 médiathèque livres CD|1||neuf déc2020||||C:\Ludopret\Annexes\Images\1774 chez nois c'est comme ça.jpg||1|||0|||N||
1773|Intervention comportementale clinique|07/12/2020||DE Boeck|||||4 médiathèque livres CD|1||neuf déc2020||||C:\Ludopret\Annexes\Images\1773 interv comport clinique.jpg||1|||0|||N||
1783|Autisme qu'est-ce que c'est pour moi?|07/12/2020||Autisme et troubles du dvlpt|||||4 médiathèque livres CD|1||neuf déc2020||||C:\Ludopret\Annexes\Images\1783 autisme qu'est ce que c'est pour moi.JPG||1|||0|||N||
1782|Parlons des émotions|07/12/2020||Autisme et troubles du dvlpt|||||4 médiathèque livres CD|1||neuf déc2020||||C:\Ludopret\Annexes\Images\1782 parlons des émotions.JPG||1|||0|||N||
1781|Explorer les sentiments l'anxiété|07/12/2020||Autisme et troubles du dvlpt|||||4 médiathèque livres CD|1||neuf déc2020||||C:\Ludopret\Annexes\Images\1781 Explorer-les-sentiments anxiété.jpg||1|||0|||N||
1780|Explorer les sentiments la colère|07/12/2020||Autisme et troubles du dvlpt|||||4 médiathèque livres CD|1||neuf déc2020||||C:\Ludopret\Annexes\Images\1780 explorer les sentiments la colère.jpg||1|||0|||N||
1779|La marche des animaux 2|07/12/2020||Regard 9|||||4 médiathèque livres CD|1||neuf déc2020|Pour avoir une bonne posture| | |C:\Ludopret\Annexes\Images\1779-la-marche-des-animaux-2.jpg||1|||0|||N||
1778|La marche des animaux|07/12/2020||Regard 9|||||4 médiathèque livres CD|1||neuf déc2020|Pour avoir une bonne posture| | |C:\Ludopret\Annexes\Images\1778 la marche des animaux.JPG||1|||0|||N||
1762|Le bilan avec le WISC V|07/12/2020||DUNOD|||||4 médiathèque livres CD|1||neuf déc2020|et ses outils complémentaires.| | |C:\Ludopret\Annexes\Images\1762 wisc 5.JPG||1|||0|||N||
1761|Dyslexie et dysorthographie|07/12/2020||Ed de Mortagne|||||4 médiathèque livres CD|1||neuf déc2020|collection "la boite à outils"| | |C:\Ludopret\Annexes\Images\1761 dyslexie et dysorthographie.JPG||1|||0|||N||
1766|150 ergotrucs pour la classe|07/12/2020||Chenelière éducation|||||4 médiathèque livres CD|1||neuf déc2020||||C:\Ludopret\Annexes\Images\1766 150 ergotrucs.JPG||1|||0|||N||
1767|Saccade guide scolaire 4-11 ans|07/12/2020||Saccade|||||4 médiathèque livres CD|1||neuf déc2020||||C:\Ludopret\Annexes\Images\1767 saccade.JPG||1|||0|||N||
1576|Jeu d'encastrement cristaux colorés|26/01/2020||Haba|||||1 motricité fine encast puzzle|1||neuf janv20|14 pièces, 1 cadre et 12 cartes modèle.| | |C:\Ludopret\Annexes\Images\1576-jeu-dencastrement-cristaux-colores-haba.jpg||1|||0|||N||
1574|jeu d'assemblage en 3D|26/01/2020||Haba|||||1 motricité fine encast puzzle|1||neuf janv20|28 éléments, 15 cartes et 1 cadre.| | |C:\Ludopret\Annexes\Images\1574-jeu d'assemblage en 3d Haba.jpg||1|||0|||N||
1582|Cache noisettes|26/01/2020||Smart Games|||||1 motricité fine encast puzzle|1||neuf janv20|5 éléments (4 écureuils et une fleur rouge), 1 plateau et 1 livret de défis.| | |C:\Ludopret\Annexes\Images\1582-cache noisettes Smartgames.jpg||1|||0|||N||
1573|Rapido Hape|26/01/2020||Hape|||||1 motricité fine encast puzzle|1||neuf janv20|1 gros cylindre en bambou, 1 cordelette, 32 billes, 4 tubes avec élastique, 8 réglettes de couleurs.| | |C:\Ludopret\Annexes\Images\1573-rapido Hape.jpg||1|||0|||N||
1572|Magnetics Geo Bonhomme|26/01/2020||Djeco|||||1 motricité fine encast puzzle|1||neuf janv20|1 coffret en bois avec 35 pièces magnétiques et 20 cartes défis.| | |C:\Ludopret\Annexes\Images\1572-Magnetics Geo bonhomme.jpg||1|||0|||N||
1571|Yum Yum island|26/01/2020||Space Cow|||||8 jeux symboliques et imitatio|1||neuf janv20|sauver les animaux en leur parachutant des aliments mais à l'aveuglette, seulement guidé par la voix.| | |C:\Ludopret\Annexes\Images\1571-Yum-Yum-Island-Space-Cowboy1.jpg||1|||0|||N||
1570|Top That!|26/01/2020||Blue orange|||||8 jeux symboliques et imitatio|1||neuf janv20|Soyez les premiers à empiler les objets du magicien, comme indiqué sur les cartes défis, objets visibles ou non.| | |C:\Ludopret\Annexes\Images\1570-top that.jpg||1|||0|||N||
1581|Tantrix|26/01/2020||Gigamic|||||7 aide autom assoc tps|1||neuf janv20|56 tuiles, 1sac de transport et 1règle du jeu. 3 niveaux de jeu.| | |C:\Ludopret\Annexes\Images\1581-Tantrix.jpg||1|||0|||N||
1580|Formes et ombres|26/01/2020||Hape|||||7 aide autom assoc tps|1||neuf janv20|16 plaquettes et 4 plateaux. Faire correspondres les images à leurs ombres.| | |C:\Ludopret\Annexes\Images\1580-Formes et ombres Hape.jpg||1|||0|||N||
1579|Les pays d'Europe HABA|26/01/2020||Haba|||||8 jeux symboliques et imitatio|1||neuf janv20|1 règle du jeu, 1 plateau, 4 pions touristes, 4 tableaux de drapeaux et 76 cartes.| | |C:\Ludopret\Annexes\Images\1579-les-pays-d-europe-p-image-67657-grande.jpg||1|||0|||N||
1578|Jeu de laçage - le chantier HABA|26/01/2020||Haba|||||1 motricité fine encast puzzle|1||neuf janv20|10 pièces en bois, 1 sac en tissus et 1 règle du jeu.| | |C:\Ludopret\Annexes\Images\1578-Jeu de laçage HABA.jpg||1|||0|||N||
1577|Cubissimo Djeco|26/01/2020||Djeco|||||7 aide autom assoc tps|1||neuf janv20|7 pièces en bois et 30 cartes défi.| | |C:\Ludopret\Annexes\Images\1577-Cubissimo Djeco.jpg||1|||0|||N||
1567|Camion de bricolage Janod|26/01/2020||Janod|||||1 motricité fine encast puzzle|1||neuf janv20|17 pièces et 3 outils.| | |C:\Ludopret\Annexes\Images\1567-Camion de bricolage Janod.jpg||1|||0|||N||
1569|Il était une ferme|26/01/2020||Smart Games|||||7 aide autom assoc tps|1||neuf janv20|1 plateau de jeu, 4 barrières fixes et 3 mobiles, 2 vaches, 2 moutons, 2 cochons, 3 abreuvoirs et un livret de 60 défis.| | |C:\Ludopret\Annexes\Images\1569-Il était une ferme Smartgames.jpg||1|||0|||N||
1568|L'archipel des dinosaures|26/01/2020||Smart Games|||||7 aide autom assoc tps|1||neuf janv20|1 plateau, 6 tuiles et 1 livret de 80 défis.| | |C:\Ludopret\Annexes\Images\1568-L’archipel des dinosaures Smartgames.jpg||1|||0|||N||
1590|Mémo ferme Goula|29/01/2020||Goula|||||7 aide autom assoc tps|1||don janv20|34 pièces| | |C:\Ludopret\Annexes\Images\1590  - memo ferme goula.jpg||1|||10|||N||
1591|A-Z quiz|29/01/2020||Hemma|||||5 lang graph ecriture lecture|1||don janv20|40 cartes, 1 roue alphabétique et 1 règle du jeu| | |C:\Ludopret\Annexes\Images\1591 - A-Z quiz Hema.jpg||1|||5|||N||
1592|Boggle|29/01/2020||Capiepa|||||5 lang graph ecriture lecture|1||don janv20|découvrir le plus grand nb de mots.16 dés lettres, 1 shaker, 1 règle du jeu.| | |C:\Ludopret\Annexes\Images\1592 - boggle.jpg||1|||5|||N||
1593|ABC Ravensburger|29/01/2020||Ravensburger|||||4 médiathèque livres CD|1||don janv20|26 cartes puzzle alphabet et 26 cartes images.| | |C:\Ludopret\Annexes\Images\1593 - Ravensburger-ABC.jpg||1|||10|||N||
1594|Santé!|29/01/2020|||||||4 médiathèque livres CD|1||neuf janv20|auteur: Nathalie Champoux, a fait une conf à Morlaix en oct19 où on a acheté son livre.| | |C:\Ludopret\Annexes\Images\1594 - Santé! Nath Champoux.jpg||1|||0|||N||
1595|Puzzle la reine des neiges|29/01/2020||Ravensburger|||||1 motricité fine encast puzzle|1||don janv20|200 pièces. Neuf.| | |C:\Ludopret\Annexes\Images\1595 - puzzle la reine des neiges 200p.jpg||1|||0|||N||
1596|Equilibrio|10/02/2020||Foxmind|||||6 mathématiques|1||neuf janv20|1 livret de modèles et 18 formes géométriques| | |C:\Ludopret\Annexes\Images\1596 Equilibrio.jpg||1|||0|||N||
1597|escargot labyrinthe aimanté|10/02/2020||inconnu|||||1 motricité fine encast puzzle|1||don janv20|billes de couleurs aimantées avec crayon aimant| | |C:\Ludopret\Annexes\Images\1597 escargot à billes.jpg||1|||5|||N||
1598|Echasses enfant à godets|10/02/2020|||||||2 motricité globale|1||don janv20|2 échasses godets vertes| | |C:\Ludopret\Annexes\Images\1597 escargot à billes.jpg||1|||10|||N||
1599|Dominos Djeco de la ferme|10/02/2020|||||||7 aide autom assoc tps|1||don janv20|28 pièces| | |C:\Ludopret\Annexes\Images\1599 dominos djeco.jpg||1|||10|||N||
1600|Memory petits animaux|10/02/2020||Ravensburger|||||7 aide autom assoc tps|1||don janv20|1 règle du jeu et 72 cartes| | |C:\Ludopret\Annexes\Images\1600 memory animaux ravensburger.jpg||1|||5|||N||
1601|Ballon sauteur|10/02/2020||inconnu|||||2 motricité globale|1||don janv20||||C:\Ludopret\Annexes\Images\1601 ballon sauteur.jpg||1|||5|||N||
1602|Au pays des petits dragons|10/02/2020||Haba|||||8 jeux symboliques et imitatio|1||don janv20|1 règle du jeu, 1 dé spécial, 60 pierres volcaniques, 4 figurines dragons et 1 plateau en 3 morceaux, et 4 flèches sens du vent.| | |C:\Ludopret\Annexes\Images\1602 au pays des petits dragons haba.jpg||1|||10|||N||
1603|Mémo des bébés animaux|10/02/2020||Nathan|||||7 aide autom assoc tps|1||don janv20|1 règle du jeu et 54 grands jetons.| | |C:\Ludopret\Annexes\Images\1603 memory bebes animaux nathan.jpg||1|||10|||N||
1604|Couleurs et formes|10/02/2020||Nathan|||||7 aide autom assoc tps|1||don janv20|1 règle du jeu, 4 planches recto-verso, 24 jetons illustrés et 24 jetons couleurs.| | |C:\Ludopret\Annexes\Images\1604 couleurs et formes nathan.jpg||1|||10|||N||
1605|Mallette "école" Lud'autisme|27/02/2020||inconnu|||||Mallette école|1||neuf janv20|Mallette à roulettes Lud'autisme: 22 éléments à l'intèrieur.Contenu: 2 baguettes kaléidoscope, lot de 7 balles à paillettes, 1 Levita ball (1 pipe, 10 pailles, 2 pilles polystirène), 1 casque anti-bruit, 1 tour de cou lesté, 1 balle anti-stress,|  1 sachet de 150 plumes, 1 manchon Twiddle, 1 bouncy band maintien des piedds pour chaise, 1 roue de secours IDEO, 1 roue des bobos IDEO, 1 éventail des émotions Hoptoys, 1 grand tableau de comportements, 1 porte clés comportements, 1 bâton|  de pluie en métal, 1 time timer moyen modèle, 8 livres sur l'autisme (L'enfant autiste décrypté, Dans les yeux d'Emma et Teddy, Le trouble du TDA avec ou sans H, Scolariser un enfant avec autisme, Les aspects sensoriels et moteurs de l'autisme,|||1|||0|||N||
1606|Mallette "de base" Lud'autisme|27/02/2020||inconnu|||||Mallette de base|1||neuf janv20|Lot contenant 12 élémentsContenu: 1 lot intégral de pictogrammes (Jeu intégral IDEO), 1 casque anti-bruit, 1 Time Timer 20cm magnétique, 1 œuf masseur, 1 balançoire cocon southpaw et son support Hoptoys, 1 siège balançoire adapté max 45kg,| 1 caméra ICM100 Somfy et 4 livres sur l'autisme (L'enfant autiste décrypté, Dans les yeux d'Emma et Teddy, Les aspects sensoriels et moteurs de l'autisme, Aider son enfant autiste 50 fiches).| |||1|||0|||N||
1609|La guerre des clans CD|29/02/2020||Lizzie|||||4 médiathèque livres CD|1||don janv20|1 CD sur le retour à l'état sauvage lu par Erwann Zamor| | |C:\Ludopret\Annexes\Images\1609 - la guerre des clans cd histoire.jpg||1|||5|||N||
1617|Malin comme un singe|29/02/2020||Hachette|||||4 médiathèque livres CD|1||don janv20|Livre McDo| | |C:\Ludopret\Annexes\Images\1617- malin comme un singe.jpg||1|||2|||N||
1618|Simple comme bonjour|29/02/2020||Hachette|||||4 médiathèque livres CD|1||don janv20|Livre McDo| | |C:\Ludopret\Annexes\Images\1618- simple comme bonjour.jpg||1|||2|||N||
1619|Léger comme une plume|29/02/2020||Hachette|||||4 médiathèque livres CD|1||don janv20|Livre McDo| | |C:\Ludopret\Annexes\Images\1619- léger comme une plume.jpg||1|||2|||N||
1616|A la rencontre de Gustave Eiffel|29/02/2020||Hachette|||||4 médiathèque livres CD|1||don janv20|Livre McDo| | |C:\Ludopret\Annexes\Images\1616- à la rencontre de Gustave Eiffel.jpg||1|||2|||N||
1615|Le mystère des dinosaures à plume|29/02/2020||Hachette|||||4 médiathèque livres CD|1||don janv20|Livre McDo| | |C:\Ludopret\Annexes\Images\1615- Le mystère des dinosaures à plume.jpg||1|||2|||N||
1610|Tous avec le petit Poucet|29/02/2020||Hachette|||||4 médiathèque livres CD|1||don janv20|Livre McDo| | |C:\Ludopret\Annexes\Images\1610- tous avec le petit poucet.jpg||1|||2|||N||
1611|La trompette enrhumée|29/02/2020||Hachette|||||4 médiathèque livres CD|1||don janv20|Livre McDo| | |C:\Ludopret\Annexes\Images\1611- la trompette enrhumée.jpg||1|||2|||N||
1637|Qu'est-ce qu'il m'arrive? Ado garçon|11/03/2020||Usborne|||||4 médiathèque livres CD|1||neuf janv 19|La puberté chez l'ado| | |||1|||0|||N||
1638|Qu'est-ce qu'il m'arrive? Ado fille|11/03/2020||Usborne|||||4 médiathèque livres CD|1||neuf janv20|La puberté chez la fille ado.| | |||1|||0|||N||
1639|Tetris en bois|11/03/2020||inconnu|||||1 motricité fine encast puzzle|1||don janv20|1 plateau en bois et 40 pièces de bois.| | |||1|||5|||N||
1644|Les capacités de perception pour dys partie 7|28/05/2020||Upbility|||||upbility|1||neuf mai20|1 dossier avec:1 livret et 5 pochettes de jeux.| | |C:\Ludopret\Annexes\Images\1644 - DYS relations visuo-spatiales .png||1|||30|||N||
1643|Les capacités de perception visuelle dys partie 4|28/05/2020||Upbility|||||5 lang graph ecriture lecture|1||neuf mai20|partie 4: la mémoire visuelle.1 dossier comprenant: 1 livret et 5 pochettes d'activités| | |C:\Ludopret\Annexes\Images\1643 - DYS mémoire visuelle.png||1|||30|||N||
1642|Les capacités de perception visuelle dys partie 2|28/05/2020|||||||upbility|1||neuf mai20|La discrimination figure-fond.1 dossier comprenant: 1 livret et 8 pochettes d'activités| | |C:\Ludopret\Annexes\Images\1642 - discrimination figure-fond.png||1|||30|||N||
1640|Les capacités de perception visuelle dys partie 6|28/05/2020||Upbility|||||upbility|1||neuf mai20||||C:\Ludopret\Annexes\Images\1640 - la discrimination visuelle.png||1|||30|||N||
1641|Attention et concentration|28/05/2020||Upbility|||||upbility|1||neuf mai20|Stratégies d'intervention.1 dossier comprenant un livret.| | |C:\Ludopret\Annexes\Images\1641 attention et concentration.png||1|||45|||N||
1648|Pensée abstraite|28/05/2020||Upbility|||||upbility|1||neuf mai20|1 dossier comprenant 1 livret.| | |C:\Ludopret\Annexes\Images\1648 pensée abstraite.png||1|||20|||N||
1647|Compétences de la vie courante|28/05/2020||Upbility|||||upbility|1||neuf mai20|1 dossier comprenant 1 livret.| | |C:\Ludopret\Annexes\Images\1647 compétences vie courante.png||1|||30|||N||
1646|Les capacités de perception visuelle dys partie 5|28/05/2020||Upbility|||||upbility|1||neuf mai20|La mémoire visuelle séquentielle.1 dossier comprenant 1 livret et 6 pochettes d'activités.| | |C:\Ludopret\Annexes\Images\1646 DYS mémoire visu séquentielle.png||1|||30|||N||
1645|Les capacités de perception visuelle dys partie 3|28/05/2020||Upbility|||||upbility|1||neuf mai20|La constance de la forme.1 dossier comprenant 1 livret et 6 pochettes d'activités.| | |C:\Ludopret\Annexes\Images\1645 DYS constance de la forme.png||1|||30|||N||
1649|Coussin Dynair Senso|10/06/2020||Hoptoys|||||3 sensoriel musique|1||neuf mai20|1 coussin à gonfler| | |C:\Ludopret\Annexes\Images\1649 - coussin-dynair-senso-32cm.jpg||1|||0|||N||
1650|Coussin Dynair Comfort|10/06/2020||Hoptoys|||||3 sensoriel musique|1||neuf mai20||||C:\Ludopret\Annexes\Images\1650 - coussin-dynair-comfort.jpg||1|||0|||N||
