CodeJeu|NomJeu|DateAchat|Emplacement|Marque|Annee_Edition|NbJoueurs|AgeJoueurs|Manque|TypeJeu|NbPieces|TempsJeu|EtatJeu|Descriptif1|Descriptif2|Descriptif3|LienImg|Commentaire|NbPoints|NiveauJeu|Classification|PrixEstimé|Auteur|Illustrateur|SurPlace|Contenu1|Contenu2
873|dvd quelque chose en plus|09/08/2016||||||||1||||||||1|||0|||N||
874|Déclic juillet aout 2015|09/08/2016||||||||1||||||||1|||0|||N||
876|Autisme la grande enquete|11/10/2016||||||||1|||livre adulte| | |||1|||0|||N||
877|little petshop qui est ce ?|11/10/2016|||||||8 jeux symboliques et imitatio|1|||jeu de societe| | |||1|||0|||N||
878|Clown jeu de societe|11/10/2016|||||||8 jeux symboliques et imitatio|1||||||||1|||0|||N||
879|Lexifiches LX05|16/02/2017||Lexidata|||||5 lang graph ecriture lecture|1|||Niveau maternellesactivités scinetifiques, organisation temporelle, lecture fonctionnelle| | |||1|||0|||N||
88|CUDDLELOOP|27/05/2012|||||||3 sensoriel musique|0||||||||1|||0|||N||
880|Lexifiches LX 08|16/02/2017||Lexidata|||||5 lang graph ecriture lecture|1|||Niveau CP CE1mathématiques, numéraion, rangement, nombre, opération,symétire| | |||1|||0|||N||
881|Lexifiches LX 09|16/02/2017||Lexidata|||||5 lang graph ecriture lecture|1|||Niveau CP CE ensembles, mathématiquesappliqués,géométrie,mesures| | |||1|||0|||N||
882|Lexifiches LX 10|16/02/2017||Lexidata|||||5 lang graph ecriture lecture|1|||Niveau CP,lecture thématique, mathématiques, usage du dictionnaire, éveil, éducation, sécurité routière| | |||1|||0|||N||
883|Lexifiches LX 11|16/02/2017||Lexidata|||||5 lang graph ecriture lecture|1|||Niveau CE1Français, éveil| | |||1|||0|||N||
884|Lexifiches LX13|16/02/2017||Lexidata|||||5 lang graph ecriture lecture|1|||Niveau CE2approfondissement mathématiques,numéraion, additions, soustractions, multiplications, problème addition soustraction| | |||1|||0|||N||
885|Lexifiches LX15|16/02/2017||Lexidata|||||5 lang graph ecriture lecture|1|||Niveau CE2approfondissement français; phrase affirmatives, interrogatives, négatives, groupe nominal,accord sujet verbe, ponctuation, dictées| | |||1|||0|||N||
886|Lexifiches LX 17|16/02/2017||Lexidata|||||5 lang graph ecriture lecture|1|||Niveau CE2 CM1Eveil historique, scientifique, sécurité, mathématique, grammaire, conjugaison, orthographe, éducation| | |||1|||0|||N||
887|Lexifiches LX 18|16/02/2017||Lexidata|||||5 lang graph ecriture lecture|1|||Niveau CM1éveil scientifique, géographique, mathématiques, musical, orthographe| | |||1|||0|||N||
888|Lexifiches LX19|16/02/2017||Lexidata|||||5 lang graph ecriture lecture|1|||Niveau CM1 Français, grammaire, conjugaiso, éveil géographique et scientifique| | |||1|||0|||N||
889|Lexifiches LX21|16/02/2017||Lexidata|||||5 lang graph ecriture lecture|1|||Niveau CM2français, orthographe grammaticale, grammaire, conjugaison| | |||1|||0|||N||
89|Fiches CE2 comme un poisson dans l'eau|27/05/2012|||||||4 médiathèque livres CD|0||don|carnet à spirale| | |||1|||0|||N||
890|Lexifiches LX22|16/02/2017||Lexidata|||||5 lang graph ecriture lecture|1|||Niveau CM2mathématiques, fractions décimales, divisions, grandeur, temps, distances, vitesses, géométrie| | |||1|||0|||N||
891|Lexifiches LX23|16/02/2017||Lexidata|||||5 lang graph ecriture lecture|1|||Niveau CM2 6EMEprerequis orthographe, notions de grammaire, de conjugaison, lecture, éveil géographique, historique, scientifique. Compétences de base| | |||1|||0|||N||
892|Lexifiches LX 04|16/02/2017||Lexidata|||||3 sensoriel musique|1|||Niveau CM2 6ememathématiques| | |||1|||0|||N||
893|Lexifiches LX 25|16/02/2017||Lexidata|||||5 lang graph ecriture lecture|1|||Niveau CE2 à 6èmerévision maitrise,perfectionnement conjugaison, orthographe, dictionnaire, dictées| | |||1|||0|||N||
894|Lexifiches LX26|16/02/2017||Lexidata|||||5 lang graph ecriture lecture|1|||Niveau CE2 à 6èmerevision maitrise, perfectionnement grammaire, conjugaison, dictées| | |||1|||0|||N||
895|Lexifiches LX27|16/02/2017||Lexidata|||||5 lang graph ecriture lecture|1|||Niveau CE2 à la 6èmegrammaire, révision maitrise, perfectionnement. Temps simples,composés, le verbe être,avoir, les verbes en er, ir. La phrase| | |||1|||0|||N||
896|Lexifiches LX29|16/02/2017||Lexidata|||||5 lang graph ecriture lecture|1|||Niveau CPLecture, apprentissages fondamentaux| | |||1|||0|||N||
897|Lexifiches LX 32|16/02/2017||Lexidata|||||5 lang graph ecriture lecture|1|||Niveau primaireentrainement à la lecture rapide| | |||1|||0|||N||
898|Lexifiches  LX 33|16/02/2017||Lexidata|||||5 lang graph ecriture lecture|1|||Niveau collègeune obligation savoir lire. Entrainement à la lecture rapide| | |||1|||0|||N||
899|Lexifiches LX34|16/02/2017||Lexidata|||||5 lang graph ecriture lecture|1|||Niveau CE1dossier complémentaire lecture, mathématiques, éveil scientifique et histoire, sécurité, grammaire orthographe, usage du dictionnaire| | |||1|||0|||N||
9|corde à sauter n°2|27/05/2012|||||||2 motricité globale|0||don juin 2019|le précédent 9 (aéroballes) a été déclassé et remplacé par la corde à sauter en juin2019.| | |C:\Users\Utilisateur\Documents\sauvegardes ludopret\photos pour ludoprêt ne pas supprimer ni déplacer\photos motricité globale\9.jpg||1|||10|||N||
90|Eloge d'un voyage|27/05/2012||pocket|||||4 médiathèque livres CD|0||don|à l'usage des autistes et de ceux qui ne le sont pas assez. Josef Schovanec| | |||1|||5|||N||
900|Lexifiches LX 35|16/02/2017||Lexidata|||||5 lang graph ecriture lecture|1|||Niveau maternelle CPfrançais, lecture à l'écoute des sons| | |||1|||0|||N||
901|Lexifiches LX36|16/02/2017||Lexidata|||||5 lang graph ecriture lecture|1|||Niveau maternelleCPlecture à l'écoute des sons, à la rencontre des mots| | |||1|||0|||N||
902|Lexifiches LX 37|16/02/2017||Lexidata|||||5 lang graph ecriture lecture|1|||Niveau CP CE1Français lecture à l'approche des textes, jeux de lecture| | |||1|||0|||N||
903|Lexifiches LX38|16/02/2017||Lexidata|||||5 lang graph ecriture lecture|1|||Niveau CM1 CM2 6èmeHomonymes grammaticaux, acquisition et perfectionnement en orthographe| | |||1|||0|||N||
904|Lexifiche LX39|16/02/2017||Lexidata|||||5 lang graph ecriture lecture|1|||Niveau CP CE1 CE2 CM1français lecture, évitons les confusions auditives| | |||1|||0|||N||
905|Lexifiches LX47|16/02/2017||Lexidata|||||5 lang graph ecriture lecture|1|||Niveau collége français lecture, entrainement à la lecture rapide et à la compréhension. Fichier A| | |||1|||0|||N||
906|Lexifiches LX48|16/02/2017||Lexidata|||||5 lang graph ecriture lecture|1|||Niveau collègefrançais lecture. Entrainement à la lecture rapide et à la compréhension fichier B| | |||1|||0|||N||
907|Lexifiches LX49|16/02/2017||Lexidata|||||5 lang graph ecriture lecture|1|||Niveau CE1 CE2 CM1français orthographe d'usage| | |||1|||0|||N||
908|Menace à Fort Boyard|16/02/2017||livre||||||1|||aventure mystérieuse, à partir de 9 ans| | |||1|||0|||N||
909|100 idées pour aider les élèves dyscalculiques|16/02/2017||livre||||||1|||pistes destinées à toute personne cherchant à comprendre et aider les enfants rencontrant des difficultés en math et à y remédier| | |||1|||0|||N||
91|Autisme Librio|27/05/2012||Librio|||||4 médiathèque livres CD|0||don|Ce sont les parents qui en parlent le mieux| | |||1|||3|||N||
910|L'intevention précoce pour enfants autistes|16/02/2017||livre||||||1|||Nouveaux principes pour soutnier une autre intelligence.intervention précoce intensive pour enfants d'âge préscolaire| | |||1|||0|||N||
911|Jules et Rémy|16/02/2017||livre||||||1|||Livre et CDhistoire de Rémy à l'école au travers des yeux de Jules.chacun a le droità une place dans la sociète| | |||1|||0|||N||
912|Entrainement aux habilités sociales appliqué à l'a|16/02/2017||livre||||||1|||Guide pour les intervenants qui accompagnent les enfants ou ados ave des troubles du spectre autistique et souhaitent leur donner des clés de compréhension dun monde dont les codes sociaux leur échappent| | |||1|||0|||N||
913|Questions sensorielles et perceptives dans|16/02/2017||livre||||||1|||l'autisme et le syndrome d'asperger| | |||1|||0|||N||
914|Apprendre les habilités sociales|16/02/2017||livre||||||1|||Ateliers pour enfants TSA et autres TED| | |||1|||0|||N||
915|Neuropsychologie en pratique|16/02/2017||livre||||||1||||||||1|||0|||N||
916|Les histoires à raconter|16/02/2017||Montessori|||||5 lang graph ecriture lecture|1|||90 cartes pour organiser la pensée et se repérer dans le temps et favoriser l'expression orale| | |||1|||0|||N||
917|Mission animaux|16/02/2017||Nathan|||||8 jeux symboliques et imitatio|1|||Jeu d'observation et de rapidité| | |||1|||0|||N||
918|GRR! Comment surmonter sa colère|16/02/2017||livre||||||1||||||||1|||0|||N||
919|Chez la dentise|16/02/2017||livre||||||1||||||||1|||0|||N||
92|raquettes à scratch|27/05/2012||inconnu|||||2 motricité globale|0||neuf|2 raquettes et une balle à scratch| | |||1|||0|||N||
920|Mettre dans sa bouche|16/02/2017||livre||||||1|||seulement des choses qui sont bonnes pour la santé| | |||1|||0|||N||
921|Demander de l'aide à l'école|16/02/2017||livre||||||1||||||||1|||0|||N||
922|Ce que Elsa aime|16/02/2017||livre||||||1||||||||1|||0|||N||
923|Elsa va aux toilettes|16/02/2017||livre||||||1||||||||1|||0|||N||
924|Qu'arrive-t-il à Elsa ?|16/02/2017||livre||||||1||||||||1|||0|||N||
925|Qu'arrive-t-il à Tom|16/02/2017||livre||||||1||||||||1|||0|||N||
926|tom va aux toilettes|16/02/2017||livre||||||1||||||||1|||0|||N||
927|Le syndrome d'Asperger|16/02/2017||livre||||||1|||Conseils d'experts et stratégies concrètes pour comprendre le syndrome d'asperger et surmonter les difficultés qu'il pose.| | |||1|||0|||N||
928|Les jeunes autistes à la garderie et à l'école|16/02/2017||livre|||||4 médiathèque livres CD|1||||||||1|||0|||N||
929|Comprendre l'autisme pour les nuls|16/02/2017||livre|||||4 médiathèque livres CD|1||||||||1|||0|||N||
93|Hand draw ball|27/05/2012|||||||2 motricité globale|0||neuf|Une balle type rugby qui coulisse le long de 2 fils. A chaque extremité des poignées pour faire circuler la balle en écartant les bras.| | |||1|||10|||N||
930|La théorie de l'esprit|16/02/2017||livre|||||4 médiathèque livres CD|1|||Cognition, émotion, adaptation sociale| | |||1|||0|||N||
931|Je suis "spécial"|16/02/2017||livre|||||4 médiathèque livres CD|1|||Comment expliquer l'autisme aux personnes qui présentent de l'autisme| | |||1|||0|||N||
932|Les aspects sensoriels et moteurs de l'autisme|16/02/2017||livre|||||4 médiathèque livres CD|1|||travail destiné à des professionnels ou des parents ayant déjà un minimum de connaissance d base sur l'autisme.Description de ce syndrôme et de ses particularités sensorielles et motrices.| | |||1|||0|||N||
933|comprendre les rèls tacites des relations sociales|16/02/2017||livre|||||4 médiathèque livres CD|1||||||||1|||0|||N||
934|Questions sensorielles et perceptives|16/02/2017||livre|||||4 médiathèque livres CD|1|||dans l'autisme et le syndrome d'asperger| | |||1|||0|||N||
935|les troubles du comportementassociés à l'autisme|16/02/2017||livre|||||4 médiathèque livres CD|1|||et autres handicaps mentaux Texte destiné aux parents de aux professionnels| | |||1|||0|||N||
936|Dépasser l'aurisme avec le Son Rise Program|16/02/2017||livre|||||4 médiathèque livres CD|1||||||||1|||0|||N||
937|100 idées pour comprendre et préserver l'estime de|16/02/2017||livre|||||4 médiathèque livres CD|1|||soi Un guide concret pour les parents et les professionnels confrontés à des enfants ou des ados en perte de confiance en soi| | |||1|||0|||N||
938|D'une classe à l'autre|16/02/2017||livre|||||4 médiathèque livres CD|1||||||||1|||0|||N||
939|Je vais chez la coiffeuse|16/02/2017||livre|||||4 médiathèque livres CD|1||||||||1|||0|||N||
94|J'apprends à tracer les nombres|27/05/2012||Belin|||||4 médiathèque livres CD|0||don|Livret prêté sans crayon velleda.| | |||1|||5|||N||
940|Je perds une dent|16/02/2017||livre|||||4 médiathèque livres CD|1||||||||1|||0|||N||
941|Les enfants volcans|16/02/2017||livre|||||4 médiathèque livres CD|1||||||||1|||0|||N||
942|Socialement génial|16/02/2017||livre|||||4 médiathèque livres CD|1||||||||1|||0|||N||
943|Retour au calme|16/02/2017||Hoptoys|||||8 jeux symboliques et imitatio|1|||cartons d'activité| | |||1|||0|||N||
944|Résolution de problèmes|16/02/2017||Hoptoys|||||8 jeux symboliques et imitatio|1|||Jeu de carte illustrant les problèmes courant et proposant leur résolution| | |||1|||0|||N||
945|Support carte vert|17/02/2017||Hoptoys|||||7 aide autom assoc tps|1|||permet de disposer un document face au lecteur| | |||1|||0|||N||
946|Support carte rouge|17/02/2017||Hoptoys|||||7 aide autom assoc tps|1|||Permet de disposer le document verticalement face au lecteur| | |||1|||0|||N||
947|Support livre|17/02/2017||Hoptoys|||||7 aide autom assoc tps|1||||||||1|||0|||N||
948|Support livre inclinaison variable|17/02/2017||Hoptoys|||||7 aide autom assoc tps|1||||||||1|||0|||N||
949|Tour d'assiette|17/02/2017||Hoptoys|||||7 aide autom assoc tps|1||||||||1|||0|||N||
95|Ma méthode d'écriture Boscher|27/05/2012||Belin|||||4 médiathèque livres CD|0||don||||||1|||5|||N||
950|Support mobile de préhension|17/02/2017||Hoptoys|||||7 aide autom assoc tps|1||||||||1|||0|||N||
951|Balle billes multicolores|17/02/2017||Hoptoys|||||3 sensoriel musique|1|||| | |||1|||0|||N||
952|Symboles grammaticaux|17/02/2017||Montessori|||||5 lang graph ecriture lecture|1|||10 grans ronds rouges10 triangles violets10 triangles noirs10 lunes vertes10 batonnets roses10 ronds oranges10 triangles bleu foncé10 triangles bleu clair10 petits triangles bleu clair10 bonhommes dorés| | |||1|||0|||N||
953|La ronde des Bobos|17/02/2017||Hoptoys|||||7 aide autom assoc tps|1||||||||1|||0|||N||
954|La ronde ds bobos|17/02/2017||Hoptoys|||||7 aide autom assoc tps|1||||||||1|||0|||N||
955|La roue de secours|17/02/2017||Hoptoys|||||7 aide autom assoc tps|1||||||||1|||0|||N||
956|Jeu de construction Magnetico|17/02/2017||Hoptoys|||||1 motricité fine encast puzzle|1|||6 fiches modèle2 briques à roues2 personnages7 briques vertes8 briques bleues12 briques rouges11 briques jaunes| | |||1|||0|||N||
957|Dodow|17/02/2017||Hoptoys|||||7 aide autom assoc tps|1|||outil lumineux pour retrouver le sommeil| | |||1|||0|||N||
958|planche à loquets|14/03/2017||Hoptoys|||||1 motricité fine encast puzzle|1||||||||1|||0|||N||
959|Robot Blue Bot|17/02/2017||Hoptoys|||||8 jeux symboliques et imitatio|1|||1 robot 1 cable de connexion| | |||1|||0|||N||
96|DECLIC SEPTEMBRE-OCTOBRE 2011|27/05/2012|||||||4 médiathèque livres CD|0||||||||1|||0|||N||
960|Points de vue|17/02/2017||Hoptoys|||||8 jeux symboliques et imitatio|1|||72 cartes| | |||1|||0|||N||
961|Emotion  blob cards|17/02/2017||Hoptoys|||||8 jeux symboliques et imitatio|1|||48 cartesBlob des émotions et des relations sociales| | |||1|||0|||N||
962|Family BlobCards|17/02/2017|||||||8 jeux symboliques et imitatio|1|||Blob des relations familiales 48 cartes| | |||1|||0|||N||
963|What are they thinking ?|17/02/2017||Hoptoys|||||8 jeux symboliques et imitatio|1|||36 cartes| | |||1|||0|||N||
964|Social behaviour|17/02/2017||Hoptoys|||||8 jeux symboliques et imitatio|1|||44 cartes 1 livret| | |||1|||0|||N||
965|What would you do ?|17/02/2017||Hoptoys|||||8 jeux symboliques et imitatio|1|||Que ferias-tu ?| | |||1|||0|||N||
966|Arrêt de bus|17/02/2017||Hoptoys|||||8 jeux symboliques et imitatio|1|||1 tableau découpé4 tableaux bus4 jetons bus4 porte jetons40 acrtes "passagers"2 dés1 mode d'emploi| | |||1|||0|||N||
967|Mon premier Abécédaire|17/02/2017||Hemma|||||4 médiathèque livres CD|1||don sept19|sept19: remplace le coussin vibrant fonctionne avec 2 piles LR20. Jeu HS, faux-contact dans le capteur, irréparable.| | |C:\Users\Utilisateur\Documents\sauvegardes ludopret\photos pour ludoprêt ne pas supprimer ni déplacer\967-mon premier Abécédaire Hemma.jpg||1|||5|||N||
968|Toupie plate|17/02/2017||Hoptoys|||||2 motricité globale|1||||||C:\Users\Utilisateur\Documents\sauvegardes ludopret\photos pour ludoprêt ne pas supprimer ni déplacer\photos motricité globale\968.jpg||1|||0|||N||
969|Collines|17/02/2017||Hoptoys|||||2 motricité globale|1|||5 collines de hauteur différente| | |C:\Users\Utilisateur\Documents\sauvegardes ludopret\photos pour ludoprêt ne pas supprimer ni déplacer\photos motricité globale\969.jpg||1|||0|||N||
97|DECLIC NOVEMBRE-DECEMBRE 2011|27/05/2012|||||||4 médiathèque livres CD|0||||||||1|||0|||N||
970|Roller lesté|17/02/2017||Hoptoys|||||2 motricité globale|1||||||C:\Users\Utilisateur\Documents\sauvegardes ludopret\photos pour ludoprêt ne pas supprimer ni déplacer\photos motricité globale\970.jpg||1|||0|||N||
971|Disque à inclinaison build'n'balance|17/02/2017||Hoptoys|||||2 motricité globale|1|||se fixe sur un pylône haut| | |C:\Users\Utilisateur\Documents\sauvegardes ludopret\photos pour ludoprêt ne pas supprimer ni déplacer\photos motricité globale\971.jpg||1|||0|||N||
972|Pylône haut build'n'balance|17/02/2017||Hoptoys|||||2 motricité globale|1||||||C:\Users\Utilisateur\Documents\sauvegardes ludopret\photos pour ludoprêt ne pas supprimer ni déplacer\photos motricité globale\972.jpg||1|||0|||N||
973|Pylône haut build'n'balance|17/02/2017||Hoptoys|||||2 motricité globale|1||||||C:\Users\Utilisateur\Documents\sauvegardes ludopret\photos pour ludoprêt ne pas supprimer ni déplacer\photos motricité globale\972.jpg||1|||0|||N||
974|Pylône haut build'n'balance|17/02/2017||Hoptoys|||||2 motricité globale|1||||||C:\Users\Utilisateur\Documents\sauvegardes ludopret\photos pour ludoprêt ne pas supprimer ni déplacer\photos motricité globale\972.jpg||1|||0|||N||
975|Planche slack line build'n'balance|17/02/2017||Hoptoys|||||2 motricité globale|1|||à resserer  à l'usage| | |C:\Ludopret\Annexes\Images\975 Planche Slackline Build'n'balance.PNG||1|||0|||N||
976|Time timer|17/02/2017||Hemma|||||7 aide autom assoc tps|1||||||||1|||0|||N||
977|Montre time timer|17/02/2017||Hemma|||||7 aide autom assoc tps|1||||||||1|||0|||N||
978|Planning d'activités quotidienne|18/02/2017||Hemma|||||7 aide autom assoc tps|1|||1 planning36 cartes "activité"72 cartes "heure"36 cartes "horloge"12 cartes AM/PM| | |||1|||0|||N||
979|Je suis calme|18/02/2017||Hemma|||||7 aide autom assoc tps|1|||jeu magnétique1 accroche porte70 pictogrammes| | |||1|||0|||N||
98|DECLIC JANVIER-FEVRIER 2012|27/05/2012|||||||4 médiathèque livres CD|0||||||||1|||0|||N||
980|Système minuterie par 4|18/02/2017||Hemma|||||7 aide autom assoc tps|1|||4 minuteries, piles incluses, mises en fonction en mai 2019 (plastique sorti du contact des piles).Lors de cette mise en service, une minuterie HS (réglage des heures impossible), reste 4.| | |||1|||0|||N||
1281|Explorer l'école|21/01/2019||Nathan|||||8 jeux symboliques et imitatio|1||neuf janv 19|Grandes images.| | |C:\Ludopret\Annexes\Images\1281 Explorer l'école - grandes images - Nathan.PNG||1|||0|||N||
1285|Calculodingo|21/01/2019||Didacool|||||6 mathématiques|1||don juin 2019||||C:\Ludopret\Annexes\Images\1285 Calculodingo.PNG||1|||15|||N||
1286|Sonodingo|21/01/2019||Didacool|||||5 lang graph ecriture lecture|1||don juin 2019||||C:\Ludopret\Annexes\Images\1286 Sonodingo.PNG||1|||15|||N||
1288|Livre Les racines de nos maladies|21/01/2019||livre||||||1||don juin 2019||||C:\Ludopret\Annexes\Images\1288 Les racines de nos maladies.PNG||1|||20|||N||
1287|41 cours de cuisine sans gluten sans lait|21/01/2019||CD||||||1||don juin 2019||||C:\Ludopret\Annexes\Images\1287 DVD - 41 cours de cuisine sans gluten ni lait.PNG||1|||29,9|||N||
1280|Vivre ensemble grandes images|21/01/2019||Nathan|||||7 aide autom assoc tps|1||neuf janv 19||||C:\Ludopret\Annexes\Images\1280 vivre ensemble - grandes images.PNG||1|||0|||N||
1277|Parlons des expressions|21/01/2019||Nathan|||||8 jeux symboliques et imitatio|1||neuf janv 19||||C:\Ludopret\Annexes\Images\1277 Parlons des expessions - Nathan.PNG||1|||0|||N||
1278|Triolud - vocabulaire 1|21/01/2019||Nathan|||||5 lang graph ecriture lecture|1||neuf janv 19||||C:\Ludopret\Annexes\Images\1278 Trioludo - vocabulaire 1 - Nathan.PNG||1|||0|||N||
1279|Triolud - vocabulaire 2|21/01/2019||Nathan|||||5 lang graph ecriture lecture|1||neuf janv 19||||C:\Ludopret\Annexes\Images\1279 Trioludo - vocabulaire 2 - Nathan.PNG||1|||0|||N||
1282|Rouleaux de compression|21/01/2019||EMPIS Pologne|||||2 motricité globale|1||neuf janv 19||||C:\Ludopret\Annexes\Images\1282 rouleaux de compression.PNG||1|||0|||N||
1297|Mathominos|30/01/2019||Nathan|||||6 mathématiques|1||neuf janv 19||||C:\Ludopret\Annexes\Images\1297 Mathominos SED.PNG||1|||0|||N||
1293|Jeux à la carte- lecture cycle 2|30/01/2019||Nathan|||||5 lang graph ecriture lecture|1||neuf janv 19||||C:\Ludopret\Annexes\Images\1293 Jeux à la carte - lecture cycle 2 SED.PNG||1|||0|||N||
1296|Mission syllabes cycle 2|30/01/2019||Nathan|||||5 lang graph ecriture lecture|1||neuf janv 19||||C:\Ludopret\Annexes\Images\1296 Mission syllabes - cycle SED.PNG||1|||0|||N||
1292|déclassé|30/01/2019||Educa|||||8 jeux symboliques et imitatio|1||neuf janv 19| Puzzle Apprenons le corps humain, déclassé en oct 2021, manque trop de pièces!| | |C:\Ludopret\Annexes\Images\1292 Puzzle - apprenons le corps humain.PNG||1|||0|||N||
1298|livret veritech 12/12 cycle 2 rouge|30/01/2019||Nathan|||||5 lang graph ecriture lecture|1||neuf janv 19|lot de 4 livrets.| | |C:\Ludopret\Annexes\Images\1298 Livret Veritech -série 12 sur12 - cycle 2  II rouge.PNG||1|||0|||N||
1299|livret veritech cycle 2 vert clair|30/01/2019||Nathan|||||5 lang graph ecriture lecture|1||neuf janv 19|lot de 4 livrets.| | |C:\Ludopret\Annexes\Images\1299  Livret Veritech -série 12 sur12 - cycle 2  II vert clair.PNG||1|||0|||N||
1295|Chasse aux indices CM|30/01/2019||Nathan|||||5 lang graph ecriture lecture|1||neuf janv 19|Construire du sens en lecture. Fiches photocopiables.| | |C:\Ludopret\Annexes\Images\1295 La chasse aux indices cycle 3 SED.PNG||1|||0|||N||
1294|Chasse aux indices CE1|30/01/2019||Nathan|||||5 lang graph ecriture lecture|1||neuf janv 19|Construire du sens en lecture. Fiches photocopiables.| | |C:\Ludopret\Annexes\Images\1294 La chasse aux indices CE1 SED.PNG||1|||0|||N||
1301|livrets veritech 12/12 cycle 3 violet|30/01/2019||Nathan|||||5 lang graph ecriture lecture|1||neuf janv 19|lot de 4 livrets| | |||1|||0|||N||
1300|livrets veritech 12/12 cycle 3 jaune|30/01/2019||Nathan|||||5 lang graph ecriture lecture|1||neuf janv 19|lot de 4 livrets| | |C:\Ludopret\Annexes\Images\1300  Livret Veritech -série 12 sur12 - cycle 3 (1er pack) jaune.PNG||1|||0|||N||
1225|Ma journée puzzle "Mein Tag"|12/02/2019|||||||7 aide autom assoc tps|1||neuf oct18|puzzle XXL de 50 pièces| | |C:\Ludopret\Annexes\Images\1225 Puzzle XXL  My day.PNG||1|||0|||N||
1284|TOTEMIGO|12/02/2019||AXOLOTECH|||||8 jeux symboliques et imitatio|1||neuf janv 19|CLASSEUR de Fiches et 8 morceaux Totem| | |C:\Ludopret\Annexes\Images\1284 Totemigo.PNG||1|||0|||N||
1283|TOTEMIGO|09/04/2019||AXOLOTECH|||||8 jeux symboliques et imitatio|1||neuf janv 19|8 blocs et un  classeur de fiches| | |C:\Ludopret\Annexes\Images\1283 Totemigo.PNG||1|||0|||N||
1302|Flexinhib|05/06/2019||collection Attention et rééduc|||||5 lang graph ecriture lecture|1||neuf juin 2019|« Flexinhib » permet de travailler la flexibilité mentale, l'inhibition, la mémoire de travail ainsi que les capacités attentionnelles à travers plusieurs jeux de cartes.| | |||1|||0|||N||
1329|Petit décodeur illustré de l'enfant en crise|09/06/2019||Mango||||||1||neuf juin 2019||||||1|||0|||N||
1330|Petit décodeur de l'ado en crise|09/06/2019||Mango||||||1||neuf juin 2019|livre| | |||1|||0|||N||
1331|Comment comprendre mon copain autiste|09/06/2019||livre||||||1||neuf juin 2019|livre la boite à pandore| | |||1|||0|||N||
1332|TDA/H chez les Ados|09/06/2019||livre||||||1||neuf juin 2019|Edition de Mortagne| | |||1|||0|||N||
1333|Penser en image|09/06/2019||livre||||||1||neuf juin 2019|Odile Jacob Edition| | |||1|||0|||N||
1334|L'estime de soi et l'autisme|09/06/2019||livre||||||1||neuf juin 2019|Edition Très carré| | |||1|||0|||N||
1335|Calme et attentif|09/06/2019||livre||||||1||neuf juin 2019|Avec CDEdition Les arènes| | |||1|||0|||N||
1336|L'apprentissage de la sexualité|09/06/2019||livre||||||1||neuf juin 2019||||||1|||0|||N||
1337|Sexualité et syndrome d'asperger|09/06/2019||DE Boeck||||||1||neuf juin 2019||||||1|||0|||N||
1338|Sais-tu pourquoi je saute ?|09/06/2019||livre||||||1||neuf juin 2019|livre| | |||1|||0|||N||
1339|L'enfant atypique|09/06/2019||livre||||||1||neuf juin 2019||||||1|||0|||N||
1340|Albert le poussin qui fait tout de travers|18/06/2019||||||||1||don juin 2019|1 livre avec 1 cd d'histoires contées.Il y a un autre identique avec le nmr 169.| | |||1|||0|||N||
1341|Le voleur de brosses à dents|18/06/2019||||||||1||don juin 2019|livre de Eglantine Eméyé.| | |||1|||20|||N||
1342|Le premier défi de Mathieu Hidalf|18/06/2019||||||||1||don juin 2019||||||1|||7|||N||
1343|Les apprentis chercheurs- l'arc-en-ciel|18/06/2019||||||||1||don juin 2019||||||1|||7,2|||N||
1344|Pourquoi jouer avec les enfants du quartier alors.|18/06/2019||DE Boeck||||||1||neuf juin 2019|alors que je voudrais compter les grains de sable?de Temple Grandin et Sean Barron| | |||1|||0|||N||
1345|Dis maman, c'est un homme ou un animal?|18/06/2019||Hemma||||||1||neuf juin 2019|Hilde de Clercq| | |||1|||0|||N||
1346|Dans ta bulle!|18/06/2019||Marabout||||||1||neuf juin 2019|Julie Dachez| | |||1|||0|||N||
1347|Evaluer et faciliter la communication …|18/06/2019||DE Boeck||||||1||neuf juin 2019|des personnes avec handicap complexe.| | |||1|||0|||N||
